id,input,output
q9Tw8Mb_nRwbwBOy-cnCELz2dVncJh-T-turn29,What is the result ,"{""da"": ""Ta:setQuestion"", ""et"": ""fsa-theoretical"", ""ar"": ""Language"", ""sn"": ""['output']"", ""sv"": ""['?']""}"
66dc0f98c1145f84a63b5044-turn1,How does the automaton behave if the input starts with a 0 instead of a 1?,"{""da"": ""Ta:setQuestion"", ""et"": ""fsa-practical"", ""ar"": ""Language"", ""sn"": ""['input']"", ""sv"": ""['0']""}"
ijaiv0hGDVwkzukjPHEmUC6QtX9wfCHf-turn27,which is the final state ,"{""da"": ""Ta:setQuestion"", ""et"": ""fsa-practical"", ""ar"": ""State"", ""sn"": ""['finalStates']"", ""sv"": ""['?']""}"
V3HOB-turn13,What transitions enter and exit q3 ,"{""da"": ""Ta:setQuestion"", ""et"": ""fsa-practical"", ""ar"": ""Transition"", ""sn"": ""['transitions']"", ""sv"": ""[[('?','q3','?'),('q3','?','?')]]""}"
K2TB8bOVY1WHuazVxCQEhM789Y6lGaHw-turn11,briefly describe you the automaton ,"{""da"": ""Ta:request"", ""et"": ""fsa-practical"", ""ar"": ""Automata"", ""sn"": ""[]"", ""sv"": ""[]""}"
66fef34980136d0844fa0e2b-turn1,is q0 the initial state,"{""da"": ""Ta:propositionalQuestion"", ""et"": ""fsa-practical"", ""ar"": ""State"", ""sn"": ""['initialState']"", ""sv"": ""['q0']""}"
0MgCjt8WVTxN4Thm2f0TbS_vigxpGyhI-turn2,q0 is both the initial and final state.,"{""da"": ""Ta:answer"", ""et"": ""fsa-practical"", ""ar"": ""State"", ""sn"": ""['initialState','finalStates']"", ""sv"": ""['q0',['q0']]""}"
gQZalALP9AxsFfEPC9Lm_JhIimMxTW_j-turn21,Is there an arc from q1 ,"{""da"": ""Ta:propositionalQuestion"", ""et"": ""fsa-practical"", ""ar"": ""Transition"", ""sn"": ""['transitions']"", ""sv"": ""[[('q1','?','?')]]""}"
q9Tw8Mb_nRwbwBOy-cnCELz2dVncJh-T-turn13,Give me some examples of inputs and output ,"{""da"": ""Ta:request"", ""et"": ""fsa-practical"", ""ar"": ""Language"", ""sn"": ""['input','output']"", ""sv"": ""['?','?']""}"
P-_bE79Vy1PQJqftQhKxblP_VtV-DNEF-turn17,What is the final state ,"{""da"": ""Ta:setQuestion"", ""et"": ""fsa-practical"", ""ar"": ""State"", ""sn"": ""['finalStates']"", ""sv"": ""['?']""}"
P-_bE79Vy1PQJqftQhKxblP_VtV-DNEF-turn14,"It is an automaton which accepts zero or more words in a binary alphabet formed by asequence of a pair of 1s followed by a 0. There are a total of 3 states: q0, q1, and q2. q0 is both initial and end state. From each state 1 arc starts: from q0 the arc points to q2 and is marked with 1. From q2 it points to q1 and is marked with 1. From q1 it points to q0 and is marked with 0. ","{""da"": ""Ta:answer"", ""et"": ""fsa-practical"", ""ar"": ""Automata"", ""sn"": ""['alphabet','input','numberOfStates','states','initialState','finalStates','transitions']"", ""sv"": ""[['0','1'], '110','3',['q0','q1','q2'],'q0',['q0'],[('q0','q2','1'),('q2','q1','1'),('q1','q0','0')]]""}"
0SyWdd-YbWP90wUhHSiSYaBDArgtJvUi-turn3,what is the initial stage of the automaton ,"{""da"": ""Ta:setQuestion"", ""et"": ""fsa-practical"", ""ar"": ""State"", ""sn"": ""['initialState']"", ""sv"": ""['?']""}"
 _5HlGjFdH6WD3QHzT82E_hSsC1N12Z5J-turn4,"This automaton has three states. q0 is the initial and final state. q0 is connected to q2 which is in turn connected to q1. Finally, q1 is connected to q0. ","{""da"": ""Ta:answer"", ""et"": ""fsa-practical"", ""ar"": ""State"", ""sn"": ""['numberOfStates','initialState','finalStates','transitions']"", ""sv"": ""['3','q0',['q0'],[('q0','q2','Nan'),('q2','q1','Nan'),('q1','q0','Nan')]]""}"
gQZalALP9AxsFfEPC9Lm_JhIimMxTW_j-turn8,"Yes, there is a transition from q1 to q2 and is marked with 1. ","{""da"": ""Ta:answer"", ""et"": ""fsa-practical"", ""ar"": ""Transition"", ""sn"": ""['transitions']"", ""sv"": ""[[('q1','q2','1')]]""}"
Em5Mj8ykVSTl8U4QKIZ_n7L1bF8H1kL1-turn31,transition from q3,"{""da"": ""Ta:request"", ""et"": ""fsa-practical"", ""ar"": ""Transition"", ""sn"": ""['transitions']"", ""sv"": ""[[('q3','?','?')]]""}"
hIbhGTnnFCuBbgJSGj1EmY944k9a71iY-turn6,The language accepted by this automaton is made of zero or more words formed by a sequence of a pair of 1s followed by a 0. ,"{""da"": ""Ta:answer"", ""et"": ""fsa-practical"", ""ar"": ""Language"", ""sn"": ""['alphabet','input']"", ""sv"": ""[['0','1'],'110']""}"
66fef604aa9a9ff3615fab21-turn1,what are the states,"{""da"": ""Ta:setQuestion"", ""et"": ""fsa-practical"", ""ar"": ""State"", ""sn"": ""['states']"", ""sv"": ""['?']""}"
k1xVMO4RTaL82fwPSwYj5iaHpyEYTMcz-turn19,if the input is 11100 which is the result ,"{""da"": ""Ta:setQuestion"", ""et"": ""fsa-practical"", ""ar"": ""Language"", ""sn"": ""['input']"", ""sv"": ""['11100']""}"
66c99789d9a23f4774b60849-turn1,describe me the alphabet and how its used,"{""da"": ""Ta:request"", ""et"": ""fsa-practical"", ""ar"": ""Alphabet"", ""sn"": ""['alphabet']"", ""sv"": ""['?']""}"
66dc19089ddcb359f401a62a-turn1,What triggers a transition from one state to another in the automaton,"{""da"": ""Ta:setQuestion"", ""et"": ""fsa-theoretical"", ""ar"": ""Transition"", ""sn"": ""[]"", ""sv"": ""[]""}"
0MgCjt8WVTxN4Thm2f0TbS_vigxpGyhI-turn18,"I dont' know. Try just asking something like, ""How many states are there?""","{""da"": ""AutoF:autoNegative; DS:suggest"", ""et"": ""Nan"", ""ar"": ""Nan"", ""sn"": ""[]"", ""sv"": ""[]""}"
CW4txSkffsEwrT2wLOzWbeScRrQESVBu-turn53,what is a connection,"{""da"": ""Ta:setQuestion"", ""et"": ""fsa-practical"", ""ar"": ""Transition"", ""sn"": ""['transitions']"", ""sv"": ""['?']""}"
66d8a0229880ff2cbea5b446-turn1,tell me a real use case of this automation,"{""da"": ""Ta:request"", ""et"": ""fsa-theoretical"", ""ar"": ""Automata"", ""sn"": ""[]"", ""sv"": ""[]""}"
CW4txSkffsEwrT2wLOzWbeScRrQESVBu-turn6,"It is an automaton which accepts zero or more words in a binary alphabet formed by a   sequence of a triple of 1s followed by a pair of 0s. There are a total of 5 states: q0, q1,   q2, q3, and q4. q0 is both initial and end state.   From each state 1 arc starts: from q0 the arc points to q1 and is marked with 1.   From q1 it points to q2 and is marked with 1.   From q2 it points to q3 and is marked with 1.   From q3 points to q4 and is marked with 0.   Finally, from q4 points to q0 and is marked again with 0.","{""da"": ""Ta:answer"", ""et"": ""fsa-practical"", ""ar"": ""Automata"", ""sn"": ""['alphabet','input','numberOfStates','states','initialState','finalStates','transitions']"", ""sv"": ""[['0','1'],'11100','5',['q0','q1','q2','q3','q4'],'q0',['q0'],[('q0','q1','1'),('q1','q2','1'),('q2','q3','1'),('q3','q4','0'),('q4','q0','0')]]""}"
0MgCjt8WVTxN4Thm2f0TbS_vigxpGyhI-turn19,how many loops are there,"{""da"": ""Ta:setQuestion"", ""et"": ""fsa-practical"", ""ar"": ""Transition"", ""sn"": ""[]"", ""sv"": ""[]""}"
66fef3bb80136d0844fa0e35-turn1,are there other final states,"{""da"": ""Ta:propositionalQuestion"", ""et"": ""fsa-practical"", ""ar"": ""State"", ""sn"": ""['finalStates']"", ""sv"": ""['?']""}"
66d8a5ff10bc5a5425187386-turn1,how many final states the automaton has,"{""da"": ""Ta:setQuestion"", ""et"": ""fsa-practical"", ""ar"": ""State"", ""sn"": ""['numberOfFinalStates']"", ""sv"": ""['?']""}"
66c9995ed9a23f4774b6086d-turn1,can i transite from q1 to q0,"{""da"": ""Ta:propositionalQuestion"", ""et"": ""fsa-practical"", ""ar"": ""Transition"", ""sn"": ""['transitions']"", ""sv"": ""[[('q1','q0','?')]]""}"
ShIe4j-y-ekoRj_Xvt7r2MkyrvfyFPK6-turn22,"It is an automaton which accepts zero or more words in a binary alphabet formed by a sequence of a pair of 1s followed by a 0. There are a total of 3 states: q0, q1, and q2. q0 is both initial and end state. From each state 1 arc starts: from q0 the arc points to q2 and is marked with 1. From q2 it points to q1 and is marked with 1. From q1 it points to q0 and is marked with 0.","{""da"": ""Ta:answer"", ""et"": ""fsa-practical"", ""ar"": ""Automata"", ""sn"": ""['alphabet','input','numberOfStates','states','initialState','finalStates','transitions']"", ""sv"": ""[['0','1'],'110','3',['q0','q1','q2'],'q0',['q0'],[('q0','q2','1'),('q2','q1','1'),('q1','q0','0')]]""}"
"""meno""pu7A-turn2",This automaton accepts zero or more words in a binary alphabet formed by a sequence of a triple of 1s followed by a pair of 0s. ,"{""da"": ""Ta:answer"", ""et"": ""fsa-practical"", ""ar"": ""Automata"", ""sn"": ""['alphabet','input']"", ""sv"": ""[['0','1'],'11100']""}"
VMkBtJ-FIizHxrkxPyS3DniIMKBgDUwJ-turn17,what language accepts this auotmata ,"{""da"": ""Ta:setQuestion"", ""et"": ""fsa-practical"", ""ar"": ""Language"", ""sn"": ""[]"", ""sv"": ""[]""}"
ijaiv0hGDVwkzukjPHEmUC6QtX9wfCHf-turn13,are there arcs from q4 ,"{""da"": ""Ta:propositionalQuestion"", ""et"": ""fsa-practical"", ""ar"": ""Transition"", ""sn"": ""['transitions']"", ""sv"": ""[[('q4','?','?')]]""}"
66c9942fd9a23f4774b6081f-turn1,explain how words made by 1s and 0s are used,"{""da"": ""Ta:request"", ""et"": ""fsa-practical"", ""ar"": ""Language"", ""sn"": ""['alphabet']"", ""sv"": ""['0','1']""}"
66fefa899021ec0b460c69a4-turn1,Give me a list of the arcs,"{""da"": ""Ta:request"", ""et"": ""fsa-practical"", ""ar"": ""Transition"", ""sn"": ""['transitions']"", ""sv"": ""['?']""}"
AIzOyq5ExGrZ23ca0dNIWCK5C2HD3cCA-turn11,Is there a pattern among the transitions ,"{""da"": ""Ta:propositionalQuestion"", ""et"": ""fsa-practical"", ""ar"": ""Pattern"", ""sn"": ""['patternType']"", ""sv"": ""['?']""}"
66fefde89021ec0b460c69f4-turn1,What are the states connected to q3,"{""da"": ""Ta:setQuestion"", ""et"": ""fsa-practical"", ""ar"": ""State"", ""sn"": ""['transitions']"", ""sv"": ""[[('q3','?','?')]]""}"
"""meno""pu7A-turn29",Which are the transitions from q4 ,"{""da"": ""Ta:setQuestion"", ""et"": ""fsa-practical"", ""ar"": ""Transition"", ""sn"": ""['transitions']"", ""sv"": ""[[('q4','?','?')]]""}"
66feebad0281fd1ff4448ae2-turn1,what are the arcs,"{""da"": ""Ta:setQuestion"", ""et"": ""fsa-practical"", ""ar"": ""Transition"", ""sn"": ""['transitions']"", ""sv"": ""['?']""}"
k1xVMO4RTaL82fwPSwYj5iaHpyEYTMcz-turn1,what is optimization ,"{""da"": ""Ta:setQuestion"", ""et"": ""Nan"", ""ar"": ""Nan"", ""sn"": ""[]"", ""sv"": ""[]""}"
V3HOB-turn7,What transitions enter and exit q1 ,"{""da"": ""Ta:setQuestion"", ""et"": ""fsa-practical"", ""ar"": ""Transition"", ""sn"": ""['transitions']"", ""sv"": ""[[('?','q1','?'),('q1','?','?')]]""}"
66d8a53d10bc5a5425187380-turn1,based on your previous answer this automata could accept the binary string 111100,"{""da"": ""Ta:propositionalQuestion"", ""et"": ""fsa-practical"", ""ar"": ""Language"", ""sn"": ""['input']"", ""sv"": ""['111100']""}"
ctyHWUgv9B_kHA6DNcrgMxadmJZJ1sHa-turn7,There is a transition between q5 and q7 ,"{""da"": ""Ta:propositionalQuestion"", ""et"": ""fsa-practical"", ""ar"": ""Transition"", ""sn"": ""['transitions']"", ""sv"": ""[[('q5','q7','?')]]""}"
uX-G8wJ5wSxmtNvsKkQg61kTOFczKm8b-turn15,which arc from q4,"{""da"": ""Ta:setQuestion"", ""et"": ""fsa-practical"", ""ar"": ""Transition"", ""sn"": ""['transitions']"", ""sv"": ""[[('q4','?','?')]]""}"
CW4txSkffsEwrT2wLOzWbeScRrQESVBu-turn35,q2 to q3,"{""da"": ""Ta:request"", ""et"": ""fsa-practical"", ""ar"": ""Transition"", ""sn"": ""['transitions']"", ""sv"": ""[[('q2','q3','?')]]""}"
CW4txSkffsEwrT2wLOzWbeScRrQESVBu-turn21,states,"{""da"": ""Ta:request"", ""et"": ""fsa-practical"", ""ar"": ""State"", ""sn"": ""['states']"", ""sv"": ""['?']""}"
P-_bE79Vy1PQJqftQhKxblP_VtV-DNEF-turn3,How many states can I use in an automaton ,"{""da"": ""Ta:setQuestion"", ""et"": ""fsa-theoretical"", ""ar"": ""State"", ""sn"": ""['numberOfStates']"", ""sv"": ""['?']""}"
K2TB8bOVY1WHuazVxCQEhM789Y6lGaHw-turn8,From q0 there is only one transition to q2 marked with 1. ,"{""da"": ""Ta:answer"", ""et"": ""fsa-practical"", ""ar"": ""Transition"", ""sn"": ""['transitions']"", ""sv"": ""[[('q0','q2','1')]]""}"
66c998acd9a23f4774b60861-turn2,q1 is a state of this automaton. From q1 to q2 there is a transition marked          with 1. Also from q0 to q1 there is a transition marked with 1.,"{""da"": ""Ta:answer"", ""et"": ""fsa-practical"", ""ar"": ""State"", ""sn"": ""['transitions']"", ""sv"": ""[[('q1','q2','1'),('q0','q1','1')]]""}"
"""meno""pu7A-turn7",And how about the arrows ,"{""da"": ""Ta:setQuestion"", ""et"": ""fsa-practical"", ""ar"": ""Transition"", ""sn"": ""['transitions']"", ""sv"": ""['?']""}"
bq9WYgxCi_ATitsSgtUQUUqZSE2kbkAz-turn11,overview of the automaton,"{""da"": ""Ta:request"", ""et"": ""fsa-practical"", ""ar"": ""Automata"", ""sn"": ""[]"", ""sv"": ""[]""}"
0SyWdd-YbWP90wUhHSiSYaBDArgtJvUi-turn2,"A finite-state automaton is a dynamic, discrete, invariant systemin which the sets of input, output and state are finite. The system can be in any of a finite number of internal states that define the automaton. A particularly important class of automata is that of automata capable of recognizingwhether or not a string is part of a given language or not: recognizer automata. Such a finite-state automaton consists of a finite set of states and a finite set oftransitions from one state to another. For each distinct pair formed by a state of theautomaton (the departure state) and an alphabet symbol, there is a transition to anarrival state. The symbol of the pair is said to be associated with the transition, oreven that the transition ""accepts the symbol."" The state of arrival state can alsocoincide with the start state. Each finite-state automaton is uniquely associated with anoriented graph called a transition diagram. The nodes of the graph coincide with thestates of the automaton. If there is a transition from state q to state p with a as theassociated symbol, then there is an arc oriented from node q to node p and labeled withthe symbol a. See the Homepage for more. ","{""da"": ""Ta:answer"", ""et"": ""fsa-theoretical"", ""ar"": ""Automata"", ""sn"": ""[]"", ""sv"": ""[]""}"
66dde203a69c9e02a05c3d65-turn1,What input causes the automaton to move from one state to the next,"{""da"": ""Ta:setQuestion"", ""et"": ""fsa-practical"", ""ar"": ""Language"", ""sn"": ""['input']"", ""sv"": ""['?']""}"
ijaiv0hGDVwkzukjPHEmUC6QtX9wfCHf-turn29,How many final states are there ,"{""da"": ""Ta:setQuestion"", ""et"": ""fsa-practical"", ""ar"": ""State"", ""sn"": ""['numberOfFinalStates']"", ""sv"": ""['?']""}"
66d89c769880ff2cbea5b424-turn2,"I'm sorry, I don't know the answer","{""da"": ""AutoF:autoNegative"", ""et"": ""Nan"", ""ar"": ""Nan"", ""sn"": ""[]"", ""sv"": ""[]""}"
K2TB8bOVY1WHuazVxCQEhM789Y6lGaHw-turn2,"There are a total of 3 states. q0, q1, and q2. q0 is both initial and finalstate. ","{""da"": ""Ta:answer"", ""et"": ""fsa-practical"", ""ar"": ""State"", ""sn"": ""['numberOfStates','states','initialState','finalStates']"", ""sv"": ""['3',['q0','q1','q2'],'q0',['q0']]""}"
Em5Mj8ykVSTl8U4QKIZ_n7L1bF8H1kL1-turn29,arc from q2,"{""da"": ""Ta:request"", ""et"": ""fsa-practical"", ""ar"": ""Transition"", ""sn"": ""['transitions']"", ""sv"": ""[[('q2','?','?')]]""}"
66fef7c0aa9a9ff3615fab6f-turn1,what symbols accept,"{""da"": ""Ta:setQuestion"", ""et"": ""fsa-practical"", ""ar"": ""Alphabet"", ""sn"": ""['alphabet']"", ""sv"": ""['?']""}"
uW3QEQnfk56NRlWclbyBzNkqsp20ChY1-turn5,Is 11100 part of the accepted language ,"{""da"": ""Ta:propositionalQuestion"", ""et"": ""fsa-practical"", ""ar"": ""Language"", ""sn"": ""['input']"", ""sv"": ""['11100']""}"
66d89bb89880ff2cbea5b41e-turn2,"You can ask me to describe you the automaton or a more specific question about it. For      example, you can ask me about transitions or      whether there is a path between two nodes.","{""da"": ""DS:suggest"", ""et"": ""Nan"", ""ar"": ""Nan"", ""sn"": ""[]"", ""sv"": ""[]""}"
V3HOB-turn22,There are a total of 5 arcs. Try asking me if there is a particular pattern among them. ,"{""da"": ""Ta:answer; Ta:suggest"", ""et"": ""fsa-practical"", ""ar"": ""Transition"", ""sn"": ""['numberOfTransitions']"", ""sv"": ""['5']""}"
ijaiv0hGDVwkzukjPHEmUC6QtX9wfCHf-turn23,is q4 a final state ,"{""da"": ""Ta:propositionalQuestion"", ""et"": ""fsa-practical"", ""ar"": ""State"", ""sn"": ""['finalStates']"", ""sv"": ""[['q4']]""}"
ByLC2-turn7,Describe automaton ,"{""da"": ""Ta:request"", ""et"": ""fsa-practical"", ""ar"": ""Automata"", ""sn"": ""[]"", ""sv"": ""[]""}"
66d89e8f9880ff2cbea5b430-turn1,in which state would the automation goes if it read a 0 from the state q1,"{""da"": ""Ta:setQuestion"", ""et"": ""fsa-practical"", ""ar"": ""Transition"", ""sn"": ""['transitions']"", ""sv"": ""[[('q1','?','0')]]""}"
V3HOB-turn23,Is there a particular pattern ,"{""da"": ""Ta:propositionalQuestion"", ""et"": ""fsa-practical"", ""ar"": ""Pattern"", ""sn"": ""['patternType']"", ""sv"": ""['?']""}"
CW4txSkffsEwrT2wLOzWbeScRrQESVBu-turn45,describe the position of nodes,"{""da"": ""Ta:request"", ""et"": ""fsa-practical"", ""ar"": ""Automata"", ""sn"": ""['graphicRepresentation']"", ""sv"": ""['?']""}"
uW3QEQnfk56NRlWclbyBzNkqsp20ChY1-turn1,What are the accepted inputs ,"{""da"": ""Ta:setQuestion"", ""et"": ""fsa-practical"", ""ar"": ""Language"", ""sn"": ""['input']"", ""sv"": ""['?']""}"
71DvREY3rPDW1C0uzelsV6yXdSNexElS-turn13,How many states are in Automation 2 ,"{""da"": ""Ta:setQuestion"", ""et"": ""fsa-practical"", ""ar"": ""State"", ""sn"": ""['numberOfStates']"", ""sv"": ""['?']""}"
0SyWdd-YbWP90wUhHSiSYaBDArgtJvUi-turn9,what is the language accepted by the automaton ,"{""da"": ""Ta:setQuestion"", ""et"": ""fsa-practical"", ""ar"": ""Language"", ""sn"": ""[]"", ""sv"": ""[]""}"
 _5HlGjFdH6WD3QHzT82E_hSsC1N12Z5J-turn5,What direction are the connections between the states ,"{""da"": ""Ta:setQuestion"", ""et"": ""fsa-practical"", ""ar"": ""Transition"", ""sn"": ""['transitions']"", ""sv"": ""['?']""}"
66fef4d380136d0844fa0e49-turn1,What input the automaton accept,"{""da"": ""Ta:setQuestion"", ""et"": ""fsa-practical"", ""ar"": ""Language"", ""sn"": ""['input']"", ""sv"": ""['?']""}"
Em5Mj8ykVSTl8U4QKIZ_n7L1bF8H1kL1-turn15,final state,"{""da"": ""Ta:request"", ""et"": ""fsa-practical"", ""ar"": ""State"", ""sn"": ""['finalStates']"", ""sv"": ""['?']""}"
CW4txSkffsEwrT2wLOzWbeScRrQESVBu-turn47,describe the arcs,"{""da"": ""Ta:request"", ""et"": ""fsa-practical"", ""ar"": ""Transition"", ""sn"": ""['transitions']"", ""sv"": ""['?']""}"
Em5Mj8ykVSTl8U4QKIZ_n7L1bF8H1kL1-turn19,arc from q2 to q1,"{""da"": ""Ta:request"", ""et"": ""fsa-practical"", ""ar"": ""Transition"", ""sn"": ""['transitions']"", ""sv"": ""[[('q2','q1','?')]]""}"
66d89f079880ff2cbea5b434-turn1,is the automation deterministic or non-deterministic,"{""da"": ""Ta:setQuestion"", ""et"": ""fsa-practical"", ""ar"": ""Automata"", ""sn"": ""['automataType']"", ""sv"": ""['?']""}"
AIzOyq5ExGrZ23ca0dNIWCK5C2HD3cCA-turn8,There are a total of 5 arcs. Try asking me if there is a particular pattern among them.,"{""da"": ""Ta:answer"", ""et"": ""fsa-practical"", ""ar"": ""Transition"", ""sn"": ""['numberOfTransitions']"", ""sv"": ""['5']""}"
uW3QEQnfk56NRlWclbyBzNkqsp20ChY1-turn9,Is there a particular pattern among the arcs ,"{""da"": ""Ta:propositionalQuestion"", ""et"": ""fsa-practical"", ""ar"": ""Pattern"", ""sn"": ""['patternType']"", ""sv"": ""['?']""}"
Em5Mj8ykVSTl8U4QKIZ_n7L1bF8H1kL1-turn22,"Yes, there is a transition from q3 to q4 and is marked with 0.","{""da"": ""Ta:answer"", ""et"": ""fsa-practical"", ""ar"": ""Transition"", ""sn"": ""['transitions']"", ""sv"": ""[[('q3','q4','0')]]""}"
w05LD7si_oM5jBhxC-dUqFBsx77pOFB2-turn10,The language accepted by this automaton is made of zero or more words formed by a sequence of a pair of 1s followed by a 0.,"{""da"": ""Ta:answer"", ""et"": ""fsa-practical"", ""ar"": ""Language"", ""sn"": ""['alphabet','input']"", ""sv"": ""[['0','1'],'110']""}"
66dc170a9ddcb359f401a61e-turn1,What is the role of the final state in the automaton,"{""da"": ""Ta:setQuestion"", ""et"": ""fsa-theoretical"", ""ar"": ""State"", ""sn"": ""['finalStates']"", ""sv"": ""['?']""}"
w05LD7si_oM5jBhxC-dUqFBsx77pOFB2-turn1,how many states has the automata ,"{""da"": ""Ta:setQuestion"", ""et"": ""fsa-practical"", ""ar"": ""State"", ""sn"": ""['numberOfStates']"", ""sv"": ""['?']""}"
uW3QEQnfk56NRlWclbyBzNkqsp20ChY1-turn17,Is q0 the final state ,"{""da"": ""Ta:propositionalQuestion"", ""et"": ""fsa-practical"", ""ar"": ""State"", ""sn"": ""['finalStates']"", ""sv"": ""[['q0']]""}"
66dc1134c1145f84a63b5054-turn1,How many transitions are there in this automaton,"{""da"": ""Ta:setQuestion"", ""et"": ""fsa-practical"", ""ar"": ""Transition"", ""sn"": ""['numberOfTransitions']"", ""sv"": ""['?']""}"
66fef763aa9a9ff3615fab65-turn2,"A finite-state automaton is a dynamic, discrete, invariant system          in which the sets of input, output and state are finite.          The system can be in any of a finite number of internal states that define the automaton.          A particularly important class of automata is that of automata capable of recognizing          whether or not a string is part of a given language or not: recognizer automata.          Such a finite-state automaton consists of a finite set of states and a finite set of          transitions from one state to another. For each distinct pair formed by a state of the          automaton (the departure state) and an alphabet symbol, there is a transition to an          arrival state. The symbol of the pair is said to be associated with the transition, or          even that the transition ""accepts the symbol."" The state of arrival state can also          coincide with the start state. Each finite-state automaton is uniquely associated with an          oriented graph called a transition diagram. The nodes of the graph coincide with the          states of the automaton. If there is a transition from state q to state p with a as the          associated symbol, then there is an arc oriented from node q to node p and labeled with          the symbol a. See the Homepage for more.","{""da"": ""Ta:answer"", ""et"": ""fsa-theoretical"", ""ar"": ""Automata"", ""sn"": ""[]"", ""sv"": ""[]""}"
CW4txSkffsEwrT2wLOzWbeScRrQESVBu-turn7,how many transitions are ther ein the automaton,"{""da"": ""Ta:setQuestion"", ""et"": ""fsa-practical"", ""ar"": ""Transition"", ""sn"": ""['numberOfTransitions']"", ""sv"": ""['?']""}"
66c997d4d9a23f4774b6084f-turn2,"The alphabet accepted by this automaton is a binary alphabet made by 0s and 1s. If you want to know about the language accepted, ask me about it.","{""da"": ""Ta:answer"", ""et"": ""fsa-practical"", ""ar"": ""Alphabet"", ""sn"": ""['alphabet']"", ""sv"": ""[['0','1']]""}"
AIzOyq5ExGrZ23ca0dNIWCK5C2HD3cCA-turn18,"I dont' know. Try asking something like, ""What is the accepted language?""","{""da"": ""AutoF:autoNegative; DS:suggest"", ""et"": ""Nan"", ""ar"": ""Nan"", ""sn"": ""[]"", ""sv"": ""[]""}"
CW4txSkffsEwrT2wLOzWbeScRrQESVBu-turn55,represent the automaton,"{""da"": ""Ta:request"", ""et"": ""fsa-practical"", ""ar"": ""Automata"", ""sn"": ""[]"", ""sv"": ""[]""}"
Em5Mj8ykVSTl8U4QKIZ_n7L1bF8H1kL1-turn5,arcs from q4,"{""da"": ""Ta:request"", ""et"": ""fsa-practical"", ""ar"": ""Transition"", ""sn"": ""['transitions']"", ""sv"": ""[[('q4','?','?')]]""}"
AIzOyq5ExGrZ23ca0dNIWCK5C2HD3cCA-turn15,Does the automaton accept a language allowing words made of an odd number of 0s and 1s ,"{""da"": ""Ta:propositionalQuestion"", ""et"": ""fsa-practical"", ""ar"": ""Language"", ""sn"": ""['alphabet']"", ""sv"": ""[['0','1']]""}"
66c9944fd9a23f4774b60825-turn2,The language accepted by this automaton is made of zero or more words formed by a      sequence of a triple of 1s followed by a pair of 0s.,"{""da"": ""Ta:answer"", ""et"": ""fsa-practical"", ""ar"": ""Language"", ""sn"": ""['alphabet','input']"", ""sv"": ""[['0','1'],'11100']""}"
CW4txSkffsEwrT2wLOzWbeScRrQESVBu-turn25,is 1 a label for some arc,"{""da"": ""Ta:propositionalQuestion"", ""et"": ""fsa-practical"", ""ar"": ""Transition"", ""sn"": ""['transitions']"", ""sv"": ""[[('?','?','1')]]""}"
k1xVMO4RTaL82fwPSwYj5iaHpyEYTMcz-turn3,what is automation ,"{""da"": ""Ta:setQuestion"", ""et"": ""fsa-theoretical"", ""ar"": ""Automata"", ""sn"": ""[]"", ""sv"": ""[]""}"
71DvREY3rPDW1C0uzelsV6yXdSNexElS-turn6,The automaton can be represented with the states arranged as vertices of a triangle. ,"{""da"": ""Ta:answer"", ""et"": ""fsa-practical"", ""ar"": ""Automata"", ""sn"": ""['graphicRepresentation']"", ""sv"": ""['triangle']""}"
66dde2f1a69c9e02a05c3d83-turn1,What happens after the automaton reaches q4,"{""da"": ""Ta:setQuestion"", ""et"": ""fsa-practical"", ""ar"": ""Transition"", ""sn"": ""['transitions']"", ""sv"": ""[[('q4','?','?')]]""}"
CW4txSkffsEwrT2wLOzWbeScRrQESVBu-turn22,"There are a total of 5 states. q0, q1, q2, q3, and q4. q0 is both initial and final   state.","{""da"": ""Ta:answer"", ""et"": ""fsa-practical"", ""ar"": ""State"", ""sn"": ""['numberOfStates','states','initialState','finalStates']"", ""sv"": ""['5',['q0','q1','q2','q3','q4'],'q0',['q0']]""}"
CW4txSkffsEwrT2wLOzWbeScRrQESVBu-turn9,what is a pattern,"{""da"": ""Ta:setQuestion"", ""et"": ""fsa-theoretical"", ""ar"": ""Pattern"", ""sn"": ""['patternType']"", ""sv"": ""['?']""}"
66fefcb29021ec0b460c69d6-turn1,What are the states connected to q0,"{""da"": ""Ta:setQuestion"", ""et"": ""fsa-practical"", ""ar"": ""State"", ""sn"": ""['transitions']"", ""sv"": ""[[('q0','?','?')]]""}"
uX-G8wJ5wSxmtNvsKkQg61kTOFczKm8b-turn11,which arc from q3,"{""da"": ""Ta:setQuestion"", ""et"": ""fsa-practical"", ""ar"": ""Transition"", ""sn"": ""['transitions']"", ""sv"": ""[[('q3','?','?')]]""}"
g4GdzpVwjD3_X-gmkM5UQstbFQKJqh4d-turn5,atomaton 2 ,"{""da"": ""Ta:request"", ""et"": ""fsa-practical"", ""ar"": ""Automata"", ""sn"": ""[]"", ""sv"": ""[]""}"
66feea640281fd1ff4448ace-turn1,how many nodes are there?,"{""da"": ""Ta:setQuestion"", ""et"": ""fsa-practical"", ""ar"": ""State"", ""sn"": ""['numberOfStates']"", ""sv"": ""['?']""}"
66feee290281fd1ff4448b32-turn2,"Yes, there is a transition from q0 to q1 and is marked with 1.","{""da"": ""Ta:answer"", ""et"": ""fsa-practical"", ""ar"": ""Transition"", ""sn"": ""['transitions']"", ""sv"": ""[[('q0','q1','1')]]""}"
