id,input,output
bq9WYgxCi_ATitsSgtUQUUqZSE2kbkAz-turn27,patterns among arcs,"{""da"": ""OCM:selfCorrection"", ""et"": ""fsa-practical"", ""ar"": ""Pattern"", ""sn"": ""['patternType']"", ""sv"": ""['?']""}"
P-_bE79Vy1PQJqftQhKxblP_VtV-DNEF-turn31,Is there a pattern among the arcs ,"{""da"": ""Ta:propositionalQuestion"", ""et"": ""fsa-practical"", ""ar"": ""Pattern"", ""sn"": ""['patternType']"", ""sv"": ""['?']""}"
ShIe4j-y-ekoRj_Xvt7r2MkyrvfyFPK6-turn9,states and transitions,"{""da"": ""Ta:request"", ""et"": ""fsa-practical"", ""ar"": ""Transition"", ""sn"": ""['transitions','states']"", ""sv"": ""['?','?']""}"
66fefb9f9021ec0b460c69b0-turn1,How many states are there,"{""da"": ""Ta:setQuestion"", ""et"": ""fsa-practical"", ""ar"": ""State"", ""sn"": ""['numberOfStates']"", ""sv"": ""['?']""}"
71DvREY3rPDW1C0uzelsV6yXdSNexElS-turn11,Briefly describe the automaton 2 How many states are there ,"{""da"": ""Ta:request; Ta:setQuestion"", ""et"": ""fsa-practical"", ""ar"": ""Automata"", ""sn"": ""['numberOfStates']"", ""sv"": ""['?']""}"
ShIe4j-y-ekoRj_Xvt7r2MkyrvfyFPK6-turn3,what are the states and the transitions ,"{""da"": ""Ta:setQuestion"", ""et"": ""fsa-practical"", ""ar"": ""Transition;State"", ""sn"": ""['transitions','states']"", ""sv"": ""['?','?']""}"
CW4txSkffsEwrT2wLOzWbeScRrQESVBu-turn31,q0,"{""da"": ""Ta:request"", ""et"": ""fsa-practical"", ""ar"": ""State"", ""sn"": ""['transitions']"", ""sv"": ""[[('q0','?','?')]]""}"
k1xVMO4RTaL82fwPSwYj5iaHpyEYTMcz-turn15,can you deescribe the transitions ,"{""da"": ""Ta:request"", ""et"": ""fsa-practical"", ""ar"": ""Transition"", ""sn"": ""['transitions']"", ""sv"": ""['?']""}"
66c998f3d9a23f4774b60867-turn1,which is the final state,"{""da"": ""Ta:setQuestion"", ""et"": ""fsa-practical"", ""ar"": ""State"", ""sn"": ""['finalStates']"", ""sv"": ""['?']""}"
CW4txSkffsEwrT2wLOzWbeScRrQESVBu-turn2,"A finite-state automaton is a dynamic, discrete, invariant system     in which the sets of input, output and state are finite.     The system can be in any of a finite number of internal states that define the automaton.     A particularly important class of automata is that of automata capable of recognizing     whether or not a string is part of a given language or not: recognizer automata.     Such a finite-state automaton consists of a finite set of states and a finite set of     transitions from one state to another. For each distinct pair formed by a state of the     automaton (the departure state) and an alphabet symbol, there is a transition to an     arrival state. The symbol of the pair is said to be associated with the transition, or     even that the transition ""accepts the symbol."" The state of arrival state can also     coincide with the start state. Each finite-state automaton is uniquely associated with an     oriented graph called a transition diagram. The nodes of the graph coincide with the     states of the automaton. If there is a transition from state q to state p with a as the     associated symbol, then there is an arc oriented from node q to node p and labeled with     the symbol a. See the Homepage for more.","{""da"": ""Ta:answer"", ""et"": ""fsa-practical"", ""ar"": ""Automata"", ""sn"": ""[]"", ""sv"": ""[]""}"
66dde41fa69c9e02a05c3da1-turn1,Can the automaton accept an empty string,"{""da"": ""Ta:propositionalQuestion"", ""et"": ""fsa-practical"", ""ar"": ""Automata"", ""sn"": ""['input']"", ""sv"": ""['']""}"
66feeda10281fd1ff4448b14-turn1,is there an alphabet,"{""da"": ""Ta:propositionalQuestion"", ""et"": ""fsa-practical"", ""ar"": ""Alphabet"", ""sn"": ""['alphabet']"", ""sv"": ""['?']""}"
CW4txSkffsEwrT2wLOzWbeScRrQESVBu-turn37,q3 to q2,"{""da"": ""Ta:request"", ""et"": ""fsa-practical"", ""ar"": ""Transition"", ""sn"": ""['transitions']"", ""sv"": ""[[('q3','q2','?')]]""}"
V3HOB-turn1,How many states does the automaton have ,"{""da"": ""Ta:setQuestion"", ""et"": ""fsa-practical"", ""ar"": ""State"", ""sn"": ""['numberOfStates']"", ""sv"": ""['?']""}"
66dc15aa9ddcb359f401a612-turn1,What does each state do in automaton,"{""da"": ""Ta:setQuestion"", ""et"": ""fsa-practical"", ""ar"": ""State"", ""sn"": ""[]"", ""sv"": ""[]""}"
gQZalALP9AxsFfEPC9Lm_JhIimMxTW_j-turn9,What are the states connected to q0 ,"{""da"": ""Ta:setQuestion"", ""et"": ""fsa-practical"", ""ar"": ""Transition"", ""sn"": ""['transitions']"", ""sv"": ""[[('q0','?','?'),('?','q0','?')]]""}"
66dde2a9a69c9e02a05c3d79-turn1,What input causes the automaton to move from q3 to q4,"{""da"": ""Ta:setQuestion"", ""et"": ""fsa-practical"", ""ar"": ""Transition"", ""sn"": ""['transitions']"", ""sv"": ""[[('q3','q4','?')]]""}"
ctyHWUgv9B_kHA6DNcrgMxadmJZJ1sHa-turn17,What are the transitions ,"{""da"": ""Ta:setQuestion"", ""et"": ""fsa-practical"", ""ar"": ""Transition"", ""sn"": ""['transitions']"", ""sv"": ""['?']""}"
0SyWdd-YbWP90wUhHSiSYaBDArgtJvUi-turn27,what is the alphabet ,"{""da"": ""Ta:setQuestion"", ""et"": ""fsa-practical"", ""ar"": ""Alphabet"", ""sn"": ""['alphabet']"", ""sv"": ""['?']""}"
71DvREY3rPDW1C0uzelsV6yXdSNexElS-turn7,How many states does a pentagon shaped automaton have ,"{""da"": ""Ta:setQuestion"", ""et"": ""fsa-practical"", ""ar"": ""State"", ""sn"": ""['numberOfStates']"", ""sv"": ""['?']""}"
66c99adad9a23f4774b6087f-turn1,tell me something about the states ,"{""da"": ""Ta:request"", ""et"": ""fsa-practical"", ""ar"": ""State"", ""sn"": ""[]"", ""sv"": ""[]""}"
ctyHWUgv9B_kHA6DNcrgMxadmJZJ1sHa-turn22,"I don't know, try asking something like, ""What is the accepted language?"" ","{""da"": ""AutoF:autoNegative; DS:suggest"", ""et"": ""Nan"", ""ar"": ""Nan"", ""sn"": ""[]"", ""sv"": ""[]""}"
66fefefd9021ec0b460c6a12-turn1,what is the transition function,"{""da"": ""Ta:setQuestion"", ""et"": ""fsa-practical"", ""ar"": ""Transition"", ""sn"": ""['transitions']"", ""sv"": ""['?']""}"
CW4txSkffsEwrT2wLOzWbeScRrQESVBu-turn11,what is a particular pattern among arcs,"{""da"": ""Ta:setQuestion"", ""et"": ""fsa-practical"", ""ar"": ""Pattern"", ""sn"": ""['patternType']"", ""sv"": ""['?']""}"
"""meno""pu7A-turn26",From q2 there is only one transition to q3 marked with 1. ,"{""da"": ""Ta:answer"", ""et"": ""fsa-practical"", ""ar"": ""Transition"", ""sn"": ""['transitions']"", ""sv"": ""[[('q2','q3','1')]]""}"
ShIe4j-y-ekoRj_Xvt7r2MkyrvfyFPK6-turn20,"This automaton has three transitions. The first one starts at q0, being it the initial and final state. From q0 and q2 there is a transition marked as 1. From q2 to q1 there is another transition marked as 1. Finally from q1 to q0 there is a transition marked as 0.","{""da"": ""Ta:answer"", ""et"": ""fsa-practical"", ""ar"": ""Transition"", ""sn"": ""['numberOfTransitions','initialState','finalStates','transitions']"", ""sv"": ""['3','q0',['q0'],[('q0','q2','1'),('q2','q1','1'),('q1','q0','0')]]""}"
66dc1c739ddcb359f401a63c-turn2,"I dont' know. Just try asking something like, ""How is the automaton represented?","{""da"": ""AutoF:autoNegative; DS:suggest"", ""et"": ""Nan"", ""ar"": ""Nan"", ""sn"": ""[]"", ""sv"": ""[]""}"
66ff02cc9021ec0b460c6a76-turn1,what are the paths between nodes,"{""da"": ""Ta:setQuestion"", ""et"": ""fsa-practical"", ""ar"": ""Transition"", ""sn"": ""['transitions']"", ""sv"": ""['?']""}"
K2TB8bOVY1WHuazVxCQEhM789Y6lGaHw-turn14,The language accepted by this automaton is made of zero or more words formed by asequence ofa pair of 1s followed by a 0. ,"{""da"": ""Ta:answer"", ""et"": ""fsa-practical"", ""ar"": ""Language"", ""sn"": ""['alphabet','input']"", ""sv"": ""[['0','1'],'110']""}"
rHgyaZS8T8cuQ0u39AHqQBs_vaj5ePIu-turn6,This automaton can be represented as a pentagon with its states arranged as vertices. ,"{""da"": ""Ta:answer"", ""et"": ""fsa-practical"", ""ar"": ""Automata"", ""sn"": ""['graphicRepresentation']"", ""sv"": ""['pentagon']""}"
0MgCjt8WVTxN4Thm2f0TbS_vigxpGyhI-turn22,"There are a total of 3 states. q0, q1, and q2. q0 is both initial and final state.","{""da"": ""Ta:answer"", ""et"": ""fsa-practical"", ""ar"": ""State"", ""sn"": ""['numberOfStates','states','initialState','finalStates']"", ""sv"": ""['3',['q0','q1','q2'],'q0',['q0']]""}"
"""meno""pu7A-turn11",Does it have 5 states then ,"{""da"": ""Ta:checkQuestion"", ""et"": ""fsa-practical"", ""ar"": ""State"", ""sn"": ""['numberOfStates']"", ""sv"": ""['5']""}"
Em5Mj8ykVSTl8U4QKIZ_n7L1bF8H1kL1-turn25,pattern among arcs,"{""da"": ""Ta:request"", ""et"": ""fsa-practical"", ""ar"": ""Pattern"", ""sn"": ""['patternType']"", ""sv"": ""['?']""}"
66d8a07a9880ff2cbea5b44c-turn1,how many states are in the automation,"{""da"": ""Ta:setQuestion"", ""et"": ""fsa-practical"", ""ar"": ""State"", ""sn"": ""['numberOfStates']"", ""sv"": ""['?']""}"
66dde499a69c9e02a05c3dab-turn1,Does the automaton accept sequences longer than three 1s followed by two 0s,"{""da"": ""Ta:propositionalQuestion"", ""et"": ""fsa-practical"", ""ar"": ""Language"", ""sn"": ""['input']"", ""sv"": ""['not 11100']""}"
ShIe4j-y-ekoRj_Xvt7r2MkyrvfyFPK6-turn27,what are the final states,"{""da"": ""Ta:setQuestion"", ""et"": ""fsa-practical"", ""ar"": ""State"", ""sn"": ""['finalStates']"", ""sv"": ""['?']""}"
uW3QEQnfk56NRlWclbyBzNkqsp20ChY1-turn11,Is there a transition from q0 to q5 ,"{""da"": ""Ta:propositionalQuestion"", ""et"": ""fsa-practical"", ""ar"": ""Transition"", ""sn"": ""['transitions']"", ""sv"": ""[[('q0','q5','?')]]""}"
CW4txSkffsEwrT2wLOzWbeScRrQESVBu-turn5,describe the transition diagram,"{""da"": ""Ta:request"", ""et"": ""fsa-practical"", ""ar"": ""Transition"", ""sn"": ""['transitions']"", ""sv"": ""['?']""}"
rHgyaZS8T8cuQ0u39AHqQBs_vaj5ePIu-turn12,The language accepted by this automaton is made of zero or more words formed by a sequence of a triple of 1s followed by a pair of 0s. ,"{""da"": ""Ta:answer"", ""et"": ""fsa-practical"", ""ar"": ""Language"", ""sn"": ""['alphabet','input']"", ""sv"": ""[['0','1'],'11100']""}"
k1xVMO4RTaL82fwPSwYj5iaHpyEYTMcz-turn5,how many states ,"{""da"": ""Ta:setQuestion"", ""et"": ""fsa-practical"", ""ar"": ""State"", ""sn"": ""['numberOfStates']"", ""sv"": ""['?']""}"
0MgCjt8WVTxN4Thm2f0TbS_vigxpGyhI-turn11,transitions,"{""da"": ""Ta:request"", ""et"": ""fsa-practical"", ""ar"": ""Transition"", ""sn"": ""['transitions']"", ""sv"": ""['?']""}"
FaSMl3Iu-Kr6owi4byJ2me2wFzk-c7oM-turn23,If q0 were the final state the language accepted by the automaton is the same ,"{""da"": ""Ta:propositionalQuestion"", ""et"": ""fsa-practical"", ""ar"": ""State"", ""sn"": ""['finalStates']"", ""sv"": ""[['q0']]""}"
66d8a3e010bc5a542518737a-turn1,can you describe to me how works a transition function,"{""da"": ""Ta:request"", ""et"": ""fsa-theoretical"", ""ar"": ""Transition"", ""sn"": ""[]"", ""sv"": ""[]""}"
"""meno""pu7A-turn27",Which are the transitions from q3 ,"{""da"": ""Ta:setQuestion"", ""et"": ""fsa-practical"", ""ar"": ""Transition"", ""sn"": ""['transitions']"", ""sv"": ""[[('q3','?','?')]]""}"
66c99a62d9a23f4774b60879-turn1,suggest me some questions,"{""da"": ""Ta:request"", ""et"": ""Nan"", ""ar"": ""Nan"", ""sn"": ""[]"", ""sv"": ""[]""}"
rHgyaZS8T8cuQ0u39AHqQBs_vaj5ePIu-turn5,How is the automaton represented ,"{""da"": ""Ta:setQuestion"", ""et"": ""fsa-practical"", ""ar"": ""Automata"", ""sn"": ""['graphicRepresentation']"", ""sv"": ""['?']""}"
ctyHWUgv9B_kHA6DNcrgMxadmJZJ1sHa-turn20,"No, there is not a state called like this. ","{""da"": ""Ta:answer"", ""et"": ""fsa-practical"", ""ar"": ""State"", ""sn"": ""['states']"", ""sv"": ""[[]]""}"
VMkBtJ-FIizHxrkxPyS3DniIMKBgDUwJ-turn7,What is the best way to represent this automa ,"{""da"": ""Ta:setQuestion"", ""et"": ""fsa-practical"", ""ar"": ""Automata"", ""sn"": ""['graphicRepresentation']"", ""sv"": ""['?']""}"
sveUGr-bCBUSZI2QFJORfflTpgefFbKW-turn5,is q0 linked to q0 ,"{""da"": ""Ta:propositionalQuestion"", ""et"": ""fsa-practical"", ""ar"": ""Transition"", ""sn"": ""['transitions']"", ""sv"": ""[[('q0','q0','?')]]""}"
ShIe4j-y-ekoRj_Xvt7r2MkyrvfyFPK6-turn31,start states,"{""da"": ""Ta:request"", ""et"": ""fsa-practical"", ""ar"": ""State"", ""sn"": ""['initialState']"", ""sv"": ""['?']""}"
66d8a7c710bc5a542518739e-turn1,are there some pattern,"{""da"": ""Ta:setQuestion"", ""et"": ""fsa-practical"", ""ar"": ""Pattern"", ""sn"": ""['patternType']"", ""sv"": ""['?']""}"
V3HOB-turn17,What is the accepted language ,"{""da"": ""Ta:setQuestion"", ""et"": ""fsa-practical"", ""ar"": ""Language"", ""sn"": ""[]"", ""sv"": ""[]""}"
Em5Mj8ykVSTl8U4QKIZ_n7L1bF8H1kL1-turn23,how many arcs,"{""da"": ""Ta:setQuestion"", ""et"": ""fsa-practical"", ""ar"": ""Transition"", ""sn"": ""['numberOfTransitions']"", ""sv"": ""['?']""}"
uX-G8wJ5wSxmtNvsKkQg61kTOFczKm8b-turn7,which arc from q1,"{""da"": ""Ta:setQuestion"", ""et"": ""fsa-practical"", ""ar"": ""Transition"", ""sn"": ""['transitions']"", ""sv"": ""[[('q1','?','?')]]""}"
rHgyaZS8T8cuQ0u39AHqQBs_vaj5ePIu-turn4,"I dont' know. Just try asking something like, ""How is the automaton represented?"" ","{""da"": ""AutoF:autoNegative; DS:suggest"", ""et"": ""Nan"", ""ar"": ""Nan"", ""sn"": ""[]"", ""sv"": ""[]""}"
ShIe4j-y-ekoRj_Xvt7r2MkyrvfyFPK6-turn8,The automaton can be represented with the states arranged as vertices of a triangle.,"{""da"": ""Ta:answer"", ""et"": ""fsa-practical"", ""ar"": ""Automata"", ""sn"": ""['graphicRepresentation']"", ""sv"": ""['triangle']""}"
Em5Mj8ykVSTl8U4QKIZ_n7L1bF8H1kL1-turn2,"It is an automaton which accepts zero or more words in a binary alphabet formed by a sequence of a triple of 1s followed by a pair of 0s. There are a total of 5 states: q0, q1, q2, q3, and q4. q0 is both initial and end state. From each state 1 arc starts: from q0 the arc points to q1 and is marked with 1. From q1 it points to q2 and is marked with 1. From q2 it points to q3 and is marked with 1. From q3 points to q4 and is marked with 0. Finally, from q4 points to q0 and is marked again with 0.","{""da"": ""Ta:answer"", ""et"": ""fsa-practical"", ""ar"": ""Automata"", ""sn"": ""['alphabet','numberOfStates','states','initialState','finalStates','transitions']"", ""sv"": ""[['0','1'],'5',['q0','q1','q2','q3','q4'],'q0',['q0'],[('q0','q1','1'),('q1','q2','1'),('q2','q3','1'),('q3','q4','0'),('q4','q0','0')]]""}"
66c9935bd9a23f4774b60819-turn1,describe me the automaton,"{""da"": ""Ta:request"", ""et"": ""fsa-practical"", ""ar"": ""Automata"", ""sn"": ""[]"", ""sv"": ""[]""}"
ctyHWUgv9B_kHA6DNcrgMxadmJZJ1sHa-turn6,"No, there is no such transition. From q2 there is only one transition to q1 marked with 1. ","{""da"": ""Ta:answer"", ""et"": ""fsa-practical"", ""ar"": ""Transition"", ""sn"": ""['transitions']"", ""sv"": ""[[('q2','q1','1')]]""}"
k1xVMO4RTaL82fwPSwYj5iaHpyEYTMcz-turn13,How are transitions defined ,"{""da"": ""Ta:setQuestion"", ""et"": ""fsa-practical"", ""ar"": ""Transition"", ""sn"": ""['transitions']"", ""sv"": ""['?']""}"
"""meno""pu7A-turn14","There are a total of 5 states. q0, q1, q2, q3, and q4. q0 is both initial and final state. ","{""da"": ""Ta:answer"", ""et"": ""fsa-practical"", ""ar"": ""State"", ""sn"": ""['numberOfStates','states','initialState','finalStates']"", ""sv"": ""['5',['q0','q1','q2','q3','q4'],'q0',['q0']]""}"
CWD3TAUfqC2fw24zkli39Cl4vktFJSb3-turn7,Is there an arc between q0 and q1 ,"{""da"": ""Ta:propositionalQuestion"", ""et"": ""fsa-practical"", ""ar"": ""Transition"", ""sn"": ""['transitions']"", ""sv"": ""[[('q0','q1','?')]]""}"
ctyHWUgv9B_kHA6DNcrgMxadmJZJ1sHa-turn19,What are the states ,"{""da"": ""Ta:setQuestion"", ""et"": ""fsa-practical"", ""ar"": ""State"", ""sn"": ""['states']"", ""sv"": ""['?']""}"
66fef2d080136d0844fa0e17-turn1,is there a transitions from q0 to q4,"{""da"": ""Ta:propositionalQuestion"", ""et"": ""fsa-practical"", ""ar"": ""Transition"", ""sn"": ""['transitions']"", ""sv"": ""[[('q0','q4','?')]]""}"
uX-G8wJ5wSxmtNvsKkQg61kTOFczKm8b-turn5,can you describe the automaton,"{""da"": ""Ta:request"", ""et"": ""fsa-practical"", ""ar"": ""Automata"", ""sn"": ""[]"", ""sv"": ""[]""}"
ctyHWUgv9B_kHA6DNcrgMxadmJZJ1sHa-turn4,"It is an automaton which accepts zero or more words in a binary alphabet formed by a sequence of a couple of 1s followed by a 0. There are a total of 3 states: q0, q1, and q2. q0 is both initial and end state. From each state one arc starts: from q0 the arc points to q2 and is marked by 1. From q2 it points to q1 and is marked by 1. Finally, from q1 it points to q0 and is marked by 0. ","{""da"": ""Ta:answer"", ""et"": ""fsa-practical"", ""ar"": ""Automata"", ""sn"": ""['alphabet','numberOfStates','states','initialState','finalStates','transitions']"", ""sv"": ""[['0','1'],'3',['q0','q1','q2'],'q0',['q0'],[('q0','q2','1'),('q2','q1','1'),('q1','q0','0')]]""}"
g4GdzpVwjD3_X-gmkM5UQstbFQKJqh4d-turn7,where is automaton 2 ,"{""da"": ""Ta:setQuestion"", ""et"": ""fsa-practical"", ""ar"": ""Automata"", ""sn"": ""[]"", ""sv"": ""[]""}"
66c996a3d9a23f4774b60843-turn1,describe me the transitions,"{""da"": ""Ta:request"", ""et"": ""fsa-practical"", ""ar"": ""Transition"", ""sn"": ""['transitions']"", ""sv"": ""['?']""}"
"""meno""pu7A-turn30",From q4 there is only one transition to q0 marked with 0. ,"{""da"": ""Ta:answer"", ""et"": ""fsa-practical"", ""ar"": ""Transition"", ""sn"": ""['transitions']"", ""sv"": ""[[('q4','q0','0')]]""}"
q9Tw8Mb_nRwbwBOy-cnCELz2dVncJh-T-turn31,Output ,"{""da"": ""OCM:selfCorrection"", ""et"": ""fsa-theoretical"", ""ar"": ""Language"", ""sn"": ""['output']"", ""sv"": ""['?']""}"
66d89f719880ff2cbea5b43a-turn1,"given the deterministc nature of the automation, why there is no a transition when I am in q1 and the automation read 0","{""da"": ""Ta:setQuestion"", ""et"": ""fsa-practical"", ""ar"": ""Transition"", ""sn"": ""['transitions']"", ""sv"": ""[[('q1','?','0')]]""}"
66d8a6b410bc5a5425187392-turn1,how can i reach the state q4 from the state q2,"{""da"": ""Ta:setQuestion"", ""et"": ""fsa-practical"", ""ar"": ""Transition"", ""sn"": ""['stateFrom','stateTo']"", ""sv"": ""['q2','q4']""}"
rHgyaZS8T8cuQ0u39AHqQBs_vaj5ePIu-turn10,"It is an automaton which accepts zero or more words in a binary alphabet formed by a sequence of a triple of 1s followed by a pair of 0s. There are a total of 5 states: q0, q1, q2, q3, and q4. q0 is both initial and end state. From each state 1 arc starts: from q0 the arc points to q1 and is marked with 1. From q1 it points to q2 and is marked with 1. From q2 it points to q3 and is marked with 1. From q3 points to q4 and is marked with 0. Finally, from q4 points to q0 and is marked again with 0. ","{""da"": ""Ta:answer"", ""et"": ""fsa-practical"", ""ar"": ""Automata"", ""sn"": ""['alphabet','numberOfStates','states','initialState','finalStates','transitions']"", ""sv"": ""[['0','1'],'5',['q0','q1','q2','q3','q4'],'q0',['q0'],[('q0','q1','1'),('q1','q2','1'),('q2','q3','1'),('q3','q4','0'),('q4','q0','0')]]""}"
ShIe4j-y-ekoRj_Xvt7r2MkyrvfyFPK6-turn14,"I dont' know. Try asking something like, ""Which is the initial state?""","{""da"": ""AutoF:autoNegative; DS:suggest"", ""et"": ""Nan"", ""ar"": ""Nan"", ""sn"": ""[]"", ""sv"": ""[]""}"
Em5Mj8ykVSTl8U4QKIZ_n7L1bF8H1kL1-turn6,From q4 there is only one transition to q0 marked with 0.,"{""da"": ""Ta:answer"", ""et"": ""fsa-practical"", ""ar"": ""Transition"", ""sn"": ""['transitions']"", ""sv"": ""[[('q4','q0','0')]]""}"
rHgyaZS8T8cuQ0u39AHqQBs_vaj5ePIu-turn7,has it cycles ,"{""da"": ""Ta:propositionalQuestion"", ""et"": ""fsa-practical"", ""ar"": ""Pattern"", ""sn"": ""['patternType']"", ""sv"": ""['?']""}"
ctyHWUgv9B_kHA6DNcrgMxadmJZJ1sHa-turn8,"I don't know, try asking something like, ""Describe this automaton."" ","{""da"": ""AutoF:autoNegative; DS:suggest"", ""et"": ""Nan"", ""ar"": ""Nan"", ""sn"": ""[]"", ""sv"": ""[]""}"
71DvREY3rPDW1C0uzelsV6yXdSNexElS-turn9,Briefly describe the automaton How many states are there ,"{""da"": ""Ta:request; Ta:setQuestion"", ""et"": ""fsa-practical"", ""ar"": ""Automata"", ""sn"": ""[]"", ""sv"": ""[]""}"
66feed750281fd1ff4448b0a-turn1,is there an alpabet,"{""da"": ""Ta:propositionalQuestion"", ""et"": ""fsa-practical"", ""ar"": ""Alphabet"", ""sn"": ""['alphabet']"", ""sv"": ""['?']""}"
q9Tw8Mb_nRwbwBOy-cnCELz2dVncJh-T-turn25,Talk me about transitions ,"{""da"": ""Ta:request"", ""et"": ""fsa-practical"", ""ar"": ""Transition"", ""sn"": ""['transitions']"", ""sv"": ""['?']""}"
"""meno""pu7A-turn3",Does it only accept 1s and 0s ,"{""da"": ""Ta:propositionalQuestion"", ""et"": ""fsa-practical"", ""ar"": ""Alphabet"", ""sn"": ""['alphabet']"", ""sv"": ""[['0','1']]""}"
P-_bE79Vy1PQJqftQhKxblP_VtV-DNEF-turn1,What can I use finite state automata for ,"{""da"": ""Ta:setQuestion"", ""et"": ""fsa-theoretical"", ""ar"": ""Automata"", ""sn"": ""[]"", ""sv"": ""[]""}"
66fef46080136d0844fa0e3f-turn1,what input can be processed by the automaton,"{""da"": ""Ta:setQuestion"", ""et"": ""fsa-practical"", ""ar"": ""Language"", ""sn"": ""['input']"", ""sv"": ""['?']""}"
k1xVMO4RTaL82fwPSwYj5iaHpyEYTMcz-turn17,can you describe the transitions ,"{""da"": ""OCM:selfCorrection"", ""et"": ""fsa-practical"", ""ar"": ""Transition"", ""sn"": ""['transitions']"", ""sv"": ""['?']""}"
k1xVMO4RTaL82fwPSwYj5iaHpyEYTMcz-turn7,what are the input symbols ,"{""da"": ""Ta:setQuestion"", ""et"": ""fsa-practical"", ""ar"": ""Alphabet"", ""sn"": ""['alphabet']"", ""sv"": ""['?']""}"
ShIe4j-y-ekoRj_Xvt7r2MkyrvfyFPK6-turn1,what are the states and the connections between states ,"{""da"": ""Ta:setQuestion"", ""et"": ""fsa-practical"", ""ar"": ""Transition"", ""sn"": ""['transitions']"", ""sv"": ""['?']""}"
K5RjdKDOVHgcktsKy-aBfu8jEOHFumTe-turn3,is there an arc between q0 and q1 ,"{""da"": ""Ta:propositionalQuestion"", ""et"": ""fsa-practical"", ""ar"": ""Transition"", ""sn"": ""['transitions']"", ""sv"": ""[[('q0','q1','?')]]""}"
66d8a74310bc5a5425187398-turn1,is there a way to reach the state q1 from the state q3,"{""da"": ""Ta:propositionalQuestion"", ""et"": ""fsa-practical"", ""ar"": ""Transition"", ""sn"": ""['stateFrom','stateTo']"", ""sv"": ""['q1','q3']""}"
CW4txSkffsEwrT2wLOzWbeScRrQESVBu-turn27,what is the accepted language,"{""da"": ""Ta:setQuestion"", ""et"": ""fsa-practical"", ""ar"": ""Language"", ""sn"": ""['input']"", ""sv"": ""['?']""}"
ijaiv0hGDVwkzukjPHEmUC6QtX9wfCHf-turn25,which are the final states ,"{""da"": ""Ta:setQuestion"", ""et"": ""fsa-practical"", ""ar"": ""State"", ""sn"": ""['finalStates']"", ""sv"": ""['?']""}"
66c994cdd9a23f4774b60831-turn1,is there a particular pattern among the arcs,"{""da"": ""Ta:propositionalQuestion"", ""et"": ""fsa-practical"", ""ar"": ""Pattern"", ""sn"": ""['patternType']"", ""sv"": ""['?']""}"
66c998acd9a23f4774b60861-turn1,describe me the state q1,"{""da"": ""Ta:request"", ""et"": ""fsa-practical"", ""ar"": ""State"", ""sn"": ""['states']"", ""sv"": ""[['q1']]""}"
0SyWdd-YbWP90wUhHSiSYaBDArgtJvUi-turn28,"The alphabet accepted by this automaton is a binary alphabet made by 0s and 1s. If you want toknow about the language accepted, ask me about it. ","{""da"": ""Ta:answer"", ""et"": ""fsa-practical"", ""ar"": ""Alphabet"", ""sn"": ""[]"", ""sv"": ""[]""}"
bq9WYgxCi_ATitsSgtUQUUqZSE2kbkAz-turn10,"This automaton has five transitions. From q0 to q1 there is an arc marked as 1. From q1 to q2 there is another arc marked as 1. From q2 to q3 there is an arc marked as 1. From q3 to q4 there is an arc marked as 0. Finally, from q4 to q0 there is an arc marked as 0.","{""da"": ""Ta:answer"", ""et"": ""fsa-practical"", ""ar"": ""Transition"", ""sn"": ""['numberOfTransitions','transitions']"", ""sv"": ""['5',[('q0','q1','1'),('q1','q2','1'),('q2','q3','1'),('q3','q4','0'),('q4','q0','0')]]""}"
66fefb889021ec0b460c69ae-turn1,give to me the list of states,"{""da"": ""Ta:request"", ""et"": ""fsa-practical"", ""ar"": ""State"", ""sn"": ""['states']"", ""sv"": ""['?']""}"
66fef5a4aa9a9ff3615fab1f-turn1,what are the nodes,"{""da"": ""Ta:setQuestion"", ""et"": ""fsa-practical"", ""ar"": ""State"", ""sn"": ""['states']"", ""sv"": ""['?']""}"
ijaiv0hGDVwkzukjPHEmUC6QtX9wfCHf-turn19,how many final states there are ,"{""da"": ""Ta:setQuestion"", ""et"": ""fsa-practical"", ""ar"": ""State"", ""sn"": ""['numberOfFinalStates']"", ""sv"": ""['?']""}"
66c9944fd9a23f4774b60825-turn1,What is the accepted language,"{""da"": ""Ta:setQuestion"", ""et"": ""fsa-practical"", ""ar"": ""Language"", ""sn"": ""['input']"", ""sv"": ""['?']""}"
sveUGr-bCBUSZI2QFJORfflTpgefFbKW-turn7,is q1 linked to q4 ,"{""da"": ""Ta:propositionalQuestion"", ""et"": ""fsa-practical"", ""ar"": ""Transition"", ""sn"": ""['transitions']"", ""sv"": ""[[('q1','q4','?')]]""}"
66d89f079880ff2cbea5b434-turn2,This is a deterministic automaton.,"{""da"": ""Ta:answer"", ""et"": ""fsa-practical"", ""ar"": ""Automata"", ""sn"": ""['automataType']"", ""sv"": ""['deterministic']""}"
P-_bE79Vy1PQJqftQhKxblP_VtV-DNEF-turn23,Which transitions start from q1 ,"{""da"": ""Ta:setQuestion"", ""et"": ""fsa-practical"", ""ar"": ""Transition"", ""sn"": ""['transitions']"", ""sv"": ""[[('q1','?','?')]]""}"
66ff019c9021ec0b460c6a4e-turn1,is it a non-deterministic finite state automaton,"{""da"": ""Ta:propositionalQuestion"", ""et"": ""fsa-practical"", ""ar"": ""Automata"", ""sn"": ""['automataType']"", ""sv"": ""['nonDeterministic']""}"
66dc11bfc1145f84a63b505e-turn1,Is there a particular pattern among the transitions in this automaton,"{""da"": ""Ta:setQuestion"", ""et"": ""fsa-practical"", ""ar"": ""Pattern"", ""sn"": ""['patternType']"", ""sv"": ""['?']""}"
hIbhGTnnFCuBbgJSGj1EmY944k9a71iY-turn5,What language does the automaton accept ,"{""da"": ""Ta:setQuestion"", ""et"": ""fsa-practical"", ""ar"": ""Language"", ""sn"": ""[]"", ""sv"": ""[]""}"
VMkBtJ-FIizHxrkxPyS3DniIMKBgDUwJ-turn11,What is the initial state ,"{""da"": ""Ta:setQuestion"", ""et"": ""fsa-practical"", ""ar"": ""State"", ""sn"": ""['initialState']"", ""sv"": ""['?']""}"
gQZalALP9AxsFfEPC9Lm_JhIimMxTW_j-turn17,Is there an arc from q4 ,"{""da"": ""Ta:propositionalQuestion"", ""et"": ""fsa-practical"", ""ar"": ""Transition"", ""sn"": ""['transitions']"", ""sv"": ""[[('q4','?','?')]]""}"
